<!ELEMENT books (book+)>
<!ELEMENT book (id,name,author+,price?,imported?)>
<!ELEMENT id (#PCDATA)>
<!ELEMENT name (#PCDATA)>
<!ELEMENT author (#PCDATA)>
<!ELEMENT price (#PCDATA)>
<!ELEMENT imported EMPTY>
